[
  {
    "claim_type": "compound_target",
    "compound": "Lysergic acid diethylamide (LSD)",
    "target": "5HT2A receptor",
    "raw_entity_label": "5HT2A receptors",
    "entity_role": "molecular_target",
    "clinical_context_condition": "not_applicable",
    "graph_entity_label": "5HT2A receptor",
    "graph_entity_type": "target",
    "graph_include_candidate": true,
    "graph_exclusion_reason": "not_reported",
    "mechanism_type": "ligand",
    "assay_type": "binding assay",
    "assay_family": "receptor binding",
    "action_type": "ligand",
    "affinity_type": "",
    "affinity_value": "",
    "affinity_unit": "",
    "result_direction": "not_applicable",
    "species": "human",
    "model_or_system": "platelets",
    "system": "in_vitro",
    "study_title": "Serotonin receptors in platelets of bipolar and schizoaffective patients: effect of lithium treatment",
    "authors": "Ghanshyam N. Pandey; Subhash C. Pandey; Xinguo Ren; Yogesh Dwivedi; Philip G. Janicak",
    "study_year": 2003,
    "paper_type": "primary_results",
    "source": "doi",
    "source_type": "primary_study",
    "source_family": "original_empirical",
    "paper_assessment_route": "primary_evidence",
    "evidence_strength": "uncertain",
    "support": "supported",
    "confidence": 1.0,
    "needs_human_review": false,
    "supporting_quote": "The Bmax and K(D) of 5HT2A receptors were quantitated by binding techniques using [125I]lysergic acid diethylamide (LSD) as a ligand.",
    "access_level": "abstract_only",
    "evidence_location": "abstract",
    "evidence_locator": "abstract",
    "study_design": "observational_case_control",
    "funding": "NIMH NIH HHS",
    "conflicts_of_interest": "not_reported",
    "risk_of_bias_summary": "not_reported",
    "notes": "Projected from extraction_v1; support=supported; confidence=1; needs_human_review=False",
    "study_doi": "10.1007/s00213-003-1530-y",
    "study_journal": "Psychopharmacology",
    "publication_type": "journal-article",
    "publication_date": "2003-11-01",
    "journal_issn": "0033-3158",
    "journal_eissn": "1432-2072",
    "publisher": "Springer Science and Business Media LLC",
    "mesh_terms": "Adult | Analysis of Variance | Antipsychotic Agents / therapeutic use | Binding Sites | Bipolar Disorder / blood | Bipolar Disorder / drug therapy | Bipolar Disorder / metabolism | Blood Platelets / drug effects | Blood Platelets / metabolism | Drug Therapy, Combination | Female | Humans | Iodine Isotopes / pharmacokinetics | Lithium / pharmacology | Lithium / therapeutic use | Lysergic Acid Diethylamide / pharmacokinetics | Male | Psychotic Disorders / blood | Psychotic Disorders / drug therapy | Psychotic Disorders / metabolism | Receptor, Serotonin, 5-HT2A / metabolism | Serotonin 5-HT2 Receptor Agonists | Serotonin 5-HT2 Receptor Antagonists | Suicide, Attempted | Tissue Distribution",
    "funders": "NIMH NIH HHS",
    "grant_ids": "R01-MH56528",
    "language": "eng",
    "sample_size_total": "",
    "sample_size_by_arm": "",
    "comparator": "",
    "intervention_or_exposure": "",
    "dose": "",
    "route": "",
    "session_count_or_duration": "",
    "primary_outcome": "",
    "outcome_measure": "",
    "timepoint": "",
    "effect_size": "",
    "p_value": "",
    "confidence_interval": "",
    "adverse_events": "",
    "evidence_level": "medium"
  },
  {
    "claim_type": "compound_target",
    "compound": "(R)-ketamine",
    "target": "NMDA receptor GluN2D subunit",
    "raw_entity_label": "GluN2D subunit",
    "entity_role": "molecular_target",
    "clinical_context_condition": "not_applicable",
    "graph_entity_label": "NMDA receptor GluN2D subunit",
    "graph_entity_type": "target",
    "graph_include_candidate": true,
    "graph_exclusion_reason": "not_applicable",
    "mechanism_type": "in vivo functional assay",
    "assay_type": "behavioral assay (tail-suspension test)",
    "assay_family": "in vivo functional assay",
    "action_type": "",
    "affinity_type": "",
    "affinity_value": "",
    "affinity_unit": "",
    "result_direction": "not_applicable",
    "species": "Mice",
    "model_or_system": "GluN2D-KO mice",
    "system": "preclinical",
    "study_title": "Role of NMDA receptor GluN2D subunit in the antidepressant effects of enantiomers of ketamine",
    "authors": "Soichiro Ide; Yuiko Ikekubo; Masayoshi Mishina; Kenji Hashimoto; Kazutaka Ikeda",
    "study_year": 2017,
    "paper_type": "primary_results",
    "source": "doi",
    "source_type": "primary_study",
    "source_family": "original_empirical",
    "paper_assessment_route": "primary_evidence",
    "evidence_strength": "uncertain",
    "support": "supported",
    "confidence": 1.0,
    "needs_human_review": false,
    "supporting_quote": "These data suggest that the GluN2D subunit is critical for the sustained antidepressant effects of (R)-ketamine.",
    "access_level": "abstract_only",
    "evidence_location": "abstract",
    "evidence_locator": "abstract",
    "study_design": "knockout mouse study",
    "funding": "Japan Agency for Medical Research and Development | Japan Society for the Promotion of Science",
    "conflicts_of_interest": "not_reported",
    "risk_of_bias_summary": "not_reported",
    "notes": "Projected from extraction_v1; support=supported; confidence=1.0; needs_human_review=False",
    "study_doi": "10.1016/j.jphs.2017.11.001",
    "study_journal": "Journal of Pharmacological Sciences",
    "publication_type": "journal-article",
    "publication_date": "2017-11-01",
    "journal_issn": "1347-8613",
    "journal_eissn": "1347-8648",
    "publisher": "Elsevier BV",
    "mesh_terms": "Animals | Antidepressive Agents / administration & dosage | Antidepressive Agents / pharmacology | Antidepressive Agents / therapeutic use | Depression / drug therapy | Injections, Intraperitoneal | Ketamine / administration & dosage | Ketamine / pharmacology | Ketamine / therapeutic use | Mice, Inbred C57BL | Receptors, N-Methyl-D-Aspartate / physiology | Stereoisomerism",
    "keywords": "Depression | GluN2D | Ketamine",
    "funders": "Japan Agency for Medical Research and Development | Japan Society for the Promotion of Science",
    "grant_ids": "17mk0101076h0002 | 17dk030707s0101",
    "language": "eng",
    "trial_registry_ids": "not_reported",
    "sample_size_total": "",
    "sample_size_by_arm": "",
    "comparator": "",
    "intervention_or_exposure": "",
    "dose": "",
    "route": "",
    "session_count_or_duration": "",
    "primary_outcome": "",
    "outcome_measure": "",
    "timepoint": "",
    "effect_size": "",
    "p_value": "",
    "confidence_interval": "",
    "adverse_events": "",
    "evidence_level": "medium"
  }
]
